id,comment
@hinguri0219,"주변사람들 힘들어하는 거 챙기고 위로해주면서정작 나는 괜찮은지 모르겠네나는 누구한테 힘들다고 말하고 기대는 사람이아니라서, 그런 일이 있어도 혼자 참고 견디는 사람이라서, 위로받으려다가 상처받는 게 무서운 사람이라누구 앞에서 편히 울고 어리광부리고 괜찮은 척안 하는 사람이 가끔 너무너무 부러웠다혼자 버티고 있어봐야 나만 더 아프고 힘든데나는 왜 이렇게 남들 한테 터놓는 게 힘든지."
@user-tf2fe4hk9h,"저는 고3인데 요즘 진로고민때문에 너무 힘드네요..저는 남들처럼 공부를 열심히 한 것도 아니고 고등학교 올라와서부터는 아예 손을 놓고 제가 초딩때부터 자신있어 해 왔고 제일 좋아했던 쪽으로 갈 생각밖에 안 하다가 시도했다가 좀 힘들거라는 걸 알게 되니까 한순간에 멘붕이 오더라구요.그래서 요즘 제가 그 꿈에 대해 너무 간절하지 않았다는 생각이 들고 그러더라구요 근데 제 주변 사람들은 절 믿어주는데 제가 제 자신을 못믿어서 아직까지도 결정을 못내리고 너무 힘든 거 같아요 선생님도 너무 믿고 응원해주셨는데 그 기대를 저버리는 거 같아서 죄송한데 진짜 너무 힘드네요,,"
@user-rv9bd7vb4h,솔직해지고싶다 남 신경안쓰고 나 하고싶은대로 내가 가장 소중하다는걸 티내면서.. 항상 주변사람들 신경쓰느라 내 속마음 썩어가는건 어쩔수없다 참아내면서 남들이하는 모진말은 왜 다 귀기울여 듣고 이해하려하는지 알다가도 모르겠어요 냉정한 판단을 하려해도 상대방의 입장을 생각해서 서운할까봐 알고보면 나쁜의도는 아니었으니까 하며 합리화 하고 거절도 잘 못하고 혼자 스트레스만 받아가면서 자존감은 점점 더 낮아지고 나에대한 확신만 적어지네요쉽게 바뀌지 않는 내 성격을 가지고 나는 왜이럴까 자책하며 우울해하고있었는데 노래들으면서 위로받고 갑니다 울고나니까 제가 했던 고민이 조금은 가벼워보여서 한결 편하게 잘수있을것 같습니다 감사해요
@user-xp5hk8dh4m,여기에 댓글 쓰는 모든 분들이 지나가는 시련으로 여겨서 웃으며 이야기할 수 있는 날이 빨리 왔으면 좋겠어요
@user-nj3kt1pw5o,"제발...제발...단 한번이라도..아무나 날 믿어줘...아님..위로라도 해줘..""수고했어"" ""힘들지?"" ""사랑해"" ""난 항상 니 편이야"" 이런말 한번이라도..해줘..죽고싶어 힘들어 근데 용기가 안나.. 죽을 용기가... 너무 울고싶어 미치도록..근데 이런말 있지?""울면 지는거라고"" 나랑 싸운것들, 날 힘들게 한것들, 모들걸 견디고 겨우 일어났는데..울면..울면...내가 고생한것들은..내가 힘들고 아팠던것들은..다..물거품이 되는거잖아....내가 아파도..내가 힘들어도..날 생각해준 사람들..이제 어디갔어..다시 그때로 돌아갈래..인생 ㅈ같다고..나도 빛나고 싶고..근데..가족들에 잔소리등 은 그 빛들을..끊고 있다는걸.."
@GrrrrB,"요즘 성적, 가정 문제 때문에스트레스가 많이 쌓여 11살에우울증이 온 것 같네요.....누가 나에게 관심 한 번이라도줬으면 좋겠는데... 마음대로,생각대로 잘 안되네요.....위로 받고싶어요.. 품에 안기고싶어요.. 하지만, 뜻 대로 안되요..그래도 이 노래들을 듣고조금 위로가 되는 것 같네요....감사합니다.....! 요즘 스트레스때문에 많이 힘드신 분들!!!우리 다 함께 힘내봅시다!"
@kennygo5053,첫번째 노래에 머물게 되었고 두번째 노래에 구독과 저장을 눌렀다. 센스가 좋으시네요
@jieun0127,바닥을 향해 가라앉고 있어요어디가 바닥인지 모를 정도로 힘듦에 지쳐 겨우 버티고 잡고 있던 줄을 놓아버리고 싶지만 상처받을 내 소중한 아이들을 위해 버티고 있었지만  정말 포기하고 싶을때 알아차려준 내 부모와 형제들의 손으로 다시 버티고 있어요.노래듣는 내내 눈물이 쏟아지네요.언제까지 이 힘듦이 끝날지 모르겠지만 내 부모와 형제들 그리고 내 아이들을 위해 버텨보렵니다.
@gift_goodfortune,나의 오랜 친구야! 가끔은 지쳐도 괜찮아 가끔은 포기해도 괜찮아 그러니까 너 자신의 꽃을 스스로 꺾지만 말자 지지 않게 그냥 잠시 다치지 않도록 막아주자 그리고 너무 오래 숨지는 말자 보고싶으니까 나는 너를 너무 사랑하고 나를 너무 사랑해
@user-sg6fi8mb7v,눈물이 미치도록 흐르네요
@user-re3ex8zc6t,"내나이 31살 지독하게 빚에 시달리고내 여유,취미,친구,연애 모든걸 포기하고살아온지 6년 다되가네요 나아질 기미가 보이지 않아요이젠 정말 다 포기하고싶어서 오늘만큼은 나 자신을 위로 하기위해 술 한잔 먹었어요마지막이 될꺼라 생각한 밤 하늘 보며 주문진 바닷바람 쐬고 있어요 전 여기서 더 나아질수 있는 인생일까요진짜 너무 힘들다…."
@user-se1ip2wk5z,세상에 이렇게 힘든사람들이 있는지 몰랐어요 난 이 댓글들을 보면서 정말 우울한 모두를 꼭하고 안아주고싶네요 여러분에 우울함이 멀리 다신 보이지 않게 말이에요.
@user-qm7yq2in1z,어차피 잊혀질 사람이라면  과거때문에제 자신을 갈아먹지말것  책에서 봤다면 지난 몇년동안 어리석은 삶은 살지않았을텐데청춘들 이별에 오랜기간 슬퍼하지마세요털어버리고 좋은분만나길
@suhyoungbyun8333,안녕? 많이 힘들었지… 나도 알아. 지금 이 순간이라도 행복했으면 좋겠어. 한번 너에게 솔직해져봐. 펑펑 울어도 돼. 나도 그랬어.숨 한번 크게 쉬어봐. 조금이라도 괜찮아졌어?꼭 그랬으면 좋겠네. 힘내.수고했어. 너무 예쁘다. 고생했어. 고마워. 미안해. 난 네가 있어서 너무 좋아. 응원해. 지금까지 있어줘서 고마워. 괜찮을거야. 잘했어.내일도 버텨내자. 언젠가는 너도 저 위 별처럼 반짝반짝 빛이 날거야.이 댓글은 아마도 곧 묻어질거지만 꼭 힘내고 너의 내면의 아이를 되찾았음 해.추천곡: 투바투- 땀
@KPopKoreaPlaylist,이  시절이 너무 그립네요 .. 내나이 40살 청춘은 이제 멀리서 회상하며 살아가겠네요
@user-dr4xi2mz4m,요새 정말 되는 일이 하나도 없어요.... 쉬고 싶어지네요 이 노래들 들으몀서 생각을 비우고 정신적으로 조금이라도 여유를 가져야겠어요
@user-dw8sv2wy3f,주변에 아무도없다는게 제일 우울하게 만드는 것 같아요..인간 관계의 소중함을 없어봐야 깨닫는다는게 후회스럽네요
@depresse_06,병원 갔는데 심한 우울증 이라네요.이 노래 듣고 힘을 낼게요...
@yheeeee,다들 잘 될거에요 우리 힘내요 다같이
@user-pp3jf5zk7k,요즘 들어서 너무 힘드네요 주변에서 너는 어른이 뭐인것 같냐는 그말에 말문이 턱 막혀버리더라구요 나는 아직도 애인가봐요 힘들다는 그말도 이제 겨우 내뱉고 사는데 자꾸 뭐가 그렇게 힘드냐고 그런거 너무 티내지 말라고 하는데 이때까지 참고 살았는데 티내지 말라고하면 나는 어디가서 내감정을 털어둘수 있을까요 나는 방법도 모르고 항상 숨기고 버티고 살았고 정말 힘들때만 힘들다고 겨우 털어뒀는데 그냥 평생 참고 살았어야 했을까요 사는게 이렇게 어렵고 지치는지 모르겠어요 이럴때마다 아빠가 너무 보고싶어요 가고싶어져요 아빠에게로
@yeahmins,행복하세요 다들!
@user-bq8dw2vb1h,음악 감사합니다...소리내어 실컷 울고나니 속이 좀 시원하네요^^
@user-mm3nd4ru1x,요즘 반에서 여자애들한테 은따 당하는중인데 많이 힘드네요.. 하필 시험기간인데 마음이 너무 싱숭생숭해요. 오늘도 몸이 좀 안 좋아서 학교에 못 갔는데 여자애들이 저희 반 애들 쉬는시간에 다 모아 놓고 제가 왜 싫은지에 대해서 자기들끼리 떠들면서 엄청 뒷담을 깠다고 하더라고요... 남자애들 사이에서 어장질한다고 소문 퍼트리고 점점 저를 싫어하는 애들이 늘어나는것 같아서 너무 신경이 쓰여요 ㅠㅠ 말할때도 없어서 여기다가 하소연 해봅니다...
@user-fr1hj3iz7e,너무 힘든 어제 오늘 뭔가 잠을 잘수있게 해주는 음악이내요 아직 마음이 너무아파 다시 들어요 고맙습니다~
@Patrick-sd2cx,벌써 올해 대입인 고3이네요 언제까지나 해맑은 잼민이일줄만 알았는데 몇개월 뒤면 다 혼자 해결하고 저를 지켜주는 사람 없고 실수 덮어주는 사람 없고 모든 나에 대한 책임을 짊어져야 하겠네요 이 시기 분명 모두가 겪은 시기혹은 겪을 시기일거고 잘 넘어갔겠지만 유독 저에게 마음이 시리네요 세상 전부일줄 알았던 모든 친구들 학창시절 추억들 다 덮어두고 살기 위해 치열한 세상 속으로 들어가야 한다니 불안하지만 또 한편으로 기대가 됩니다 아름다운 그림을 그리기 위해서는 밝은 면이 보이기 위해 어두운 색이 필요한 것처럼 지금 힘든 시기도 지나가고 저만의 아름다운 색을 칠할 시기도 곧 올거라 믿어요 여러분들도 지금이 학생이든 대학생이든 회사원이든 연로하신 분이든 누구나 어두운 면이 있다면 밝은 색을 칠해야 할 순간이 오고 지금이 밝은 순간이라면 곧 칠해야 할 어두운 색 멋지게 칠할수 있길 바랍니다 모두 행복하세요
@jeehyelee3560,"삶이 고단한지 7년쯤 됐네요7년 전엔 너무 힘들어서, 극심한 우울증에 정상체중에서 1달만에 10키로가 빠졌었어요. 진짜 너무...너무 힘들었어요.아... 이래서 사람들이 자살을 하는구나... 알 수 있을 것 같은 시기였는데... 그 때 나를 잡아준건 엄마 모습 하나였어요. 그렇게 나를 잡아줄 사람 1명도 없으면, 그러면 삶을 포기할 수도 있겠구나..라는 생각이 들었던 시기였죠. 지금은.. 그 때보단, 힘들지 않네 하며 버텨요. 다시 그냥.. 평범한 행복을 느낄 수 있는 날이 왔으면 좋겠어요.."
@wjdalghm6844,저는 대학교 자퇴하고 아무것도 안하고 있는데 왜이렇게 힘들까요 아무래도 자기혐오와 우울감이 너무너무 심해서 그런것 같습니다 요즘 정신도 멍하고 뇌가 마비된것 같지만 다시 열심히 나아가기 위해 노력 해보겠습니다 플리들으면서 더더 힘내 볼께요
@user-jt2mh9ix6r,공감하게 됩니다.감사합니다~~
@user-jm3ps3qy8x,살다보면 한번씩 혹은 몇번씩 위기가 오더라구요 그때들었던 이같은 노래가 큰위로가 되었답니다 그걸 극복하고 살아있는 지금 그래도 살아있음에 감사하며 나 그때 참 힘들었구나 회상하게 될 날이 옵니다 지금 힘들어도 하루하루 살다보면 또 웃을날이 올거에요 우리 힘들어도 하루그리고 하루만 살아봅시다 그렇게 하루씩 살아봐요
@user-xt6nh3rd2j,2023년도 다들 화이팅이요!! 아즈아 합시다다들 건강하세요..
@user-io2tc5fv4d,"이런 영상들에 댓글 다시는 여러분들은 모두 우울함에서 벗어나고 싶어하는 분들 이시잖아요! 자꾸 우울하다 살기 싫다 이런 부정적인 생각들을 하게 되면 더욱 우울해지기만 할 뿐이에요, 물론 여러분들도 이걸 모르시는 건 아니실 거에요..ㅜ 누군가 위로해줬으면 좋겠고 그러니까 이렇게 댓글로나마 위로받기 위해 오시는거죠.. 세상에는 나쁜 사람들도 정말 많지만 이렇게 좋은 분들도 많아요! 그렇지만 위로 받는 거에 익숙해지시면 시간이 지날 수록 여러분들을 나약하게 만들어요.. 사소한 거에도 바로 우울해지고 안 좋은 생각들만 하게 돼고ㅠ 우울함을 이겨내기 위해서는 여러분들 스스로가 강해지셔야 해요..! 사람은 누구나 노력하면 뭐든지 할 수 있기 때문에 여러분들도 우울하다고 본인을 자책하는 행동은 절대 하시면 안돼요ㅠ 저는 오히려 우울해지면 이런 잔잔한 노래보다 신나는 노래를 들어요!여러분들이 평소에 좋아하던 가수나 아이돌 노래 중에 신나는 노래들을 듣다 보면 저도 모르게 흥이 오르더라고요!여러분들도 한 번 신나는 노래를 들어 보시는 건 어떠신가요?저는 언제나 저보다 남을 생각하며 살았어요. 그래서 항상 누굴 위로해줬으면 위로해줬지 제가 누구한테 위로받고 싶단 생각은 한 적이 없었어요. 그래서 제 꿈은 원래 음악 치료사였어요! 음악을 오랜 기간 배웠었거든요. 하지만 꿈을 접게 되었어요. 개인사이긴 하지만 아직 어린 제가 감당하긴 너무나 버거운 것들이기 때문이죠. 그렇다고 제가 남들 다 가진 것 못 가지고 그런 건 아니에요. 한 가지 못 가진 것이 있다면 마음의 안정이었죠. 사실 우울함을 이겨내기 위해서 가장 중요한 건 여러분들의 마음가짐이에요. 어떤 고난이 닥쳐도 신경 쓰지 않는다는 마인드가 가장 중요한데 저도 최근에야 이 마인드를 붙잡고 밝게 살아왔어요. 여러분들도 하실 수 있어요! 이 마음가짐만 잡으신다면 세상이 환하게 보일거에요. 하지만 저는 그 마음가짐을 오래 간직하지 못했고 결국 억지로라도 냇던 미소마저 거의 잃게 되었죠. 물론 남들 앞에선 밝은 척 하지만 혼자 잇을 땐자꾸만 아무 생각도 나지 않고 무표정으로 있게 되었네요..ㅎ 저는 결국 이렇게 되었지만 여러분들은 하실 수 있어요! 저도 한 번은 성공했었으니까요!중요한 건 꺾이지 않은 마음이라고 하잖아요! 여러분들은 꼭 마음이 꺾이지 않으시길 바라요!!"
@deamond366,힘들 때 기대어 마음껏 울 수 있는 그런 사람이 있으면 좋겠다..
@user-zd6zw7bf1n,남들을 챙겨주는게 우선인 삶을 살다보니 어느 순간 제가 남들보다 뒤쳐져 있다라는 감정이 들더라구요 남들 챙겨준거에 있어서 후회는 안하지만 그 시간동안 나를 더 사랑했더라면 지금쯤 이 노래를 안들었을까라는 생각을 하게 됩니다. 위로 받고 싶어 노래라도 들으려 했지만 댓글 하나하나 보니깐 마음이 많이 아프네요… 사람마다 느끼는 힘듦의 기준은 다 다르지만 하루 하루를 버텨보다 보면 언젠가는 무조건 좋은 날들이 생길거예요 인생은 생각했던것보다 행복과 슬픔이 비례하더라구요 힘들어서 여기 찾아와 이렇게 말하는 저에게도 조만간 좋은 일이 생기길 간절히 기도하겠습니다…
@user-vb9kb9jb7j,"간호 4학년이라 취준으로 바쁜 와중에 하루에 8시간씩 병원실습까지 하다보니 편두통이 심해서 하루하루 겁나고 속상해요.. 대병 신경과를 가도 원인은 모르겠다고 하고 이젠 처방받은 약도 안들어서 밤마다 잠도 설칩니다ㅜㅜ 내년에 간호사 되면 스트레스에, 삼교대에 건강은 더더욱 악화될텐데 벌써 싫고 힘 빠져요… 안아프고 싶어요.."
@thk6588,"주기적으로 찾아오는 도피와 우울함.. 이젠 종종 찾아오는 이 기간을 그냥 즐기기로 했어요, 눈물날때 실컷 울면 나아지듯이.. 며칠 처박혀서 이짓하다보면 또 괜찮아지겠지"
@adecheongpodo1824,"언젠간 이 지독한 외로움과 우울함이 끝나길 바라며, 혹은 이겨낼 수 있길 바라며나도 언젠가는 인간적으로 인정받고 사랑받을 수 있길 바라며"
@sanga7371,내 길이 공무원이 맞을가 생각을 매일하며 공무원 인강 선생님 같은걸 알아보고 있지만 나는 왤케 의지가 없지? 라고 생각을 하면서도 스트레스를 매일 받고 있습니다 ㅠㅠ.. 그와중에 몸이 작은체형이다보니 운동을 하고 싶어도 불균형의 몸이라서 돈도 모아야하고 운동도 해야하고 공부도 해야하는 현실을 부정하고 싶지만 오히려 할게 많아서 좋은건지는 모르겠지만 노래들을 통해서 조금이라도 격려가 되는거 같습니다 ㅠㅠ 감사합니다! (혹시 가능하시다면 플레이 리스트 노래들을 댓글로 정리 해주실수 있으신가요? 굳이 안해주셔도 됩니다!!! 혹시 정리가 되신 그게 있다면 더 빨리 제 멜론 플레이리스트에 넣어서 듣고싶어서 그래요 ㅎㅎ 한번더 감사합니다)
@user-gq4fb2tg3p,어른이 된다는게 이렇게 힘든건가 앞자리 숫자가 바뀔 때마다 마음에 무게감이 늘어가는거 같다. 행복하다는게 아직도 과거형에 남아있는것 같고 단지 크게 바라는 것 없이 남들처럼 평범함을 갖고 싶었던 건데 갈수록 평범함이 남의 것 같이 느껴진다. 탐내서는 안된다고 욕심내면 안된다는 말처럼 느껴진다. 그냥 안기며 울고싶어..
@user-zn2qu3os1p,힘들때마다 너무..듣기..좋아요...마음의..위로가되요..누군가 저한테와서..위로해줬음좋겠어요..지금 너무..울고싶네요..ㅎㅎ
@user-qh8mg4hn7b,다들 행복해야해요
@user-vr5gd3km4h,울고나서 들으니까 조금은 진정된다. 라는느낌이 퐉 오는 플리에요 최고입니다..
@ssg15944,지은아 잘하고 있어 요즘 우울한것도 많이 없어졌는데 갑자기 또 왜이래 괜찮아 여태까지 했던대로만 하자! 내일부터 운동도 이제 다시하고 작년에 잘했잖아 근데 왜이래 할수있어 그러니까 하나씩 차근차근 하자 지은이 파이팅
@user-hx5tx3hr6c,"소문에 너무 얽매이고, 신경쓰지 말아요. 힘들어 하지도 말아요. 언젠가 지나갈 거에요..언젠가는"
@user-dd4oo4pz8z,첫곡부터 마음이 올라오는 노래다..
@user-qs2fl9ru5c,저도 많이 힘들었던 하루 위로받고 갑니다 마음이 지칠 때 가장 힘든건 아무렇지 않는 척 해아되는거 같아요ㅠㅠ
@user-sc6dh1pw2s,외국생활 하고있는데 어제는 중앙역에서 바지주머니 안에 있던 휴대폰을 갈취당했습니다 공부는 안되고 되는일은 없고 화는 못내고 그냥 멍하니 있는데 화도 안나더라구요 그냥 감정을 없이 살고있습니다 우울증도 걸렸고 매일 밤이 되면 눈물이 흘려나와요 뭔가 미래는 두렵고 지금 상황은 힘들고 친구는 한명도 없어서 진짜 처음으로 아무나 비참한 나를 이해해주고 위로해주면이란생각을 하네요.. 이노래들으면 또 우는데 조금은 나아지는것 같아요 ㅎ 이런 나 괜찮아지겠죠..?
@user-mc9up9jc5b,심한우울증불안장애 약 먹구 많이좋아졌는데 힘든일이 있을때마다 한번씩 또 무너지게 되네요곁엔 아무도 없고...부모님도 안계시고...내 인생의 선택이 맞는거라고 잘할수있을거라고 누구라도 듣고싶어요.. 5년의 우울장벽을 깨고 나옵디다
@likefall71,"기대받는게 힘들어요. 모를수도있고 잘하지 못할수도있고 실수할수도 있는데 왜 그러는건지 모르겠어요. 나도 노력하는데 잘하고 싶은데 너무 지쳐서 울거나 혼자있을때, 이젠 소설 하나 읽으면서도 가슴이 쿡쿡 쑤시고 누가 누르는것 처럼 아파요. 친구들은 즐겁지만 어렵고 스트레스 받아요. 학교든 학원이든 부담되고 힘들어요. 부모님은 너무 좋아서 내가 밝은 모습을 보여드리고 싶어요. 내가 남몰래 우는거 몰랐으면 좋겠어요. 기댈사람은 있는데 털어놓을 사람은 없어요. 위로받고 싶은데, 고생했다는 말 듣고싶은데, 잘하고 있다는 말 듣고 싶은데 누군가한테 안겨서 공감 받으면서, 이해 받으면서 소리내면서 울고 털어놓고 싶은데, 사람을 못믿겠어요. 나 자신도 못믿겠고 다른사람 믿기는 더 힘들어요. 잘했다고 해주면 안돼요? 고생했다고 해주면 안돼요? 그 한마디 듣기가 이렇게 힘들줄 알았으면 기대도 안하는건데. 사는 이유를 모르겠어요. 그렇다고 죽고싶지는 않아요. 울고싶어요. 펑펑고마워요 이 노래들이"
@user-or2gc8zy2g,내가 보는 당신의 미래에는 당신이 사랑하는 사람과 함께 웃음짓고 있었어요. 지금 아무리 힘들더라도 지금 힘든 당신덕에 미래의 당신이 너무나 행복할거에요. 그러니 조금만 더 버텨줘요.
@user-hu6xl5co1e,어릴 땐 힘들다는 사람들이 이해 안 갔는데 점점 어른이 되어가니 하나씩 힘들어지기 시작하네요… 첫 시작하는 일이 어렵고 그러다 직장에서의 대인관계가 어렵고 결국 사랑까지 제 마음대로 되지 않아요.. 결국 세상에서 되게 동 떨어진 바다 한 가운데 혼자 남은 기분이 들어요.. 이 플리 들으면서 조금은 내려놔 볼게요
@ibnue9228,2년 동안 앓던 우울증이 지난 반년 동안 호전되면서 괜찮아지나 했는데 요즘 다시 옛날로 돌아온 거 같아요. 나만 빼고 다들 2년 반 씩이나 성장한 채로…노력은 계속하고 있는데 자꾸 눈물이 나고 감정 기복 때문에 너무 어렵네요ㅠ.
@memory8425,특전부사관 준비하는 고3입니다. 코로나 때문에 힘들어 죽겠는데..가족들은 술타령만하네요 살은찌고 운동은 해야되고 마스크에 헬스장 열었다 닫았다 정말 힘드네요 이 플리들으면서 정말 힘이 많이나네요 정말감사합니다꼭 좋은 결과 만들어 보겠습니다
@user-wu7eo6sr9m,"가끔은 내가 지치고 힘든걸 모르고 넘어갈때도 많아요. 계속해서 나 자신에게 세뇌를 시키는거죠. ‘난 힘들지 않다. 그러니까 계속 해야한다.’ 이런식으로요. 그렇지만 이렇게 계속 진짜 나를 부정하고, 나 스스로를 세뇌시키다보면 지침의 무게에서 헤어나오지는 못하고 오히려 더 깊게 들어가는 경우가 많은것 같아요. 어려운 일이지만 나의 힘듦을 있는 그대로 직시하고, 맞서 싸울때 비로소 나는 지침과 힘듦을 이겨낼 수 있는것 같아요. 많은 분들이 우울을 겪고, 지친다는것을 느끼는 것은 충분히 잘 싸워내고, 이겨내고 있다는 뜻일거에요. 마치 바이러스가 몸에 들어오면 우리 몸이 열을 내면서 잘 이겨내고 있다고 하는것 처럼요. 우리는 모두 하나밖에 없는 소중하고 아름다운 사람들이에요. 오늘도 다들 좋은 하루, 좋은 밤 되세요."
@user-kr7ld4hy4y,"원하는 대학합격하고 원하는 과 들어가면 모든게 행복하고 편안해질 줄 알았어요 삼수끝에 그토록 원하던 대학에 왔는데 의욕도 행복도 없어요 그냥 너무 외롭기만해요 모든게 낯설고 처음인데, 다들 제가 뭔가 더 많이 아는줄 아네요 친절하게 설명듣고싶고 따뜻한 대화하고싶어요 일시적인 관계가 너무 싫어요 뭘 해야 행복할까요 저는 정말.. 이곳에오면 소속감을 느끼고 하고싶은 걸 하면서 너무 행복할 줄 알았어요.. 배부른소리같아 남들한테 이야기도 못하겠네요"
@Chanhwi_1225,"무언가 잘 안풀릴 때면 그게 짜증나고 화나는게 아니라 일을 잘 풀어나가지 못하는 제게 화가 나고 너무 밉습니다. 어떤 일이든 쉽게 포기하고 방황 하고 스스로 이정도면 괜찮다며 합리화하는 것도 제가 너무나 미워집니다. 가끔 이런거때문인지 눈물이 터지는데 이유를 모르겠습니다. 분명 힘드니까 그러겠지 하면서도 내가 뭘 했다고?남들은 나보다 열심히 살고 더 힘들게 사는데 제가 울때면 또 제가 싫어져요. 남들에게 터놓가도 부끄러울 정도로 정말 하찮은 이유들로 힘들어하는 제가, 가끔 내가 제일 힘들다며 부풀리는 내가 너무나 싫어요. 나 자신을 사랑하기가 너무나 힘든 것 같습니다"
