id,comment
@samsamsam6769,"최선을 다하기 싫어요 노력하기 싫어요 그냥 마음 편히 지내고싶어요 내일이 싫어요 회사가 싫어요 날 보는 상사들의 눈빛이 싫어요 나도 누군가에게 사랑받는 딸이고 누군가의 소중한 친구고 누군가의 사랑스러운 연인인데 회사에만 가면 내 존재자체가 잘못이고 늘 무능해보이는 나를 탓하게 되는게, 내가 싫어지는게 너무 힘들어요"
@backbackyj,"반년이란 시간이 지났음에도 고등학생이란게 너무 힘든 것 같네요. 인제 고1 이지만 진로의 방향성, 내신 때문에 미칠 것 같아요.(가족간의 문제도 있구요) 벌써 2학기 중간고사가 끝났고 저는 발전했고 열심히 살았다고 말할 수 있어요. 그래도 저의 내신은 한없이 평범하고 그저그래요. 바보같죠. 다음 기말고사에서  또 발전해서 올리면 되겠죠. 긍정적으로 생각해봐도 결코 부정적인 생각을 무시할 수가 없어요.시험 끝난지 일주일째인데 무기력감에 미칠 것 같았고 한 번 크게 울고 나의 상처를 털어놓고 싶었는데 이런 플레이리스트 만들어주셔서 고마워요. 진심으로 감사드립니다. 열심히 살아볼게요."
@ilovemyself7822,고입 때문에 스트레스도 너무 많이 받고 사람들과의 거리가 더 멀어지는 것 같아서 너무 스트레스 받았는데 마침 알고리즘에 이게 뜨네요..감사합니다
@user-ds7fr2fy2s,"이 플리를 들으면서 미친 듯이 울었던 것 같아요. 제 자신을 어떻게 안아줄 수도 없고, 제 자신을 어떻게 사랑하고 온전히 받아들일지 잘 모르겠어요. 그래서 그냥 눈물을 흘리면서 제 얼굴을 만져주고 제 눈물을 닦아주고 스스로 머리를 쓰담어 줬어요. 그냥 오늘 밤.. 제 방에서는 이런 일이 있었다고요…"
@user-vq9zz3sm9d,인생은 살면 살수록 더 어려워지는거 같다
@user-iu8sg4lu1u,정말 너무 힘드네요 앞에서는 웃는척.. 뒤에는 울고.. 그걸 하니깐 우울함이 더 빠지는것 같아요 앞에서도 편히 울고 웃고 떠들고 하고 싶네여 척이 아니라.. 지금 이대로 살거면 후회해도 늦었겠죠…
@user-ks1wg8dk1n,정홍일님 #그늘 #별다를것없던내가 #나의것 도 위로가 되어주는곡이던데 추가 되면 좋겠습니다 ^^
@user-rj8vs4rf3m,모두 행복하세요
@user-hx5tx3hr6c,딱 필요할 때 나타나 줘서 고마워요
@user-fs5ej9td4s,"내가 정말 힘든 사람이 맞을까? 그냥 엄살이 아닐까 하며 스스로를 의심했지만 플레이리스트 제목을 보자마자 눈물이 흐르네요. 제가 힘들었던게 맞을까요? 제 이야기를 지인에게 털어놓으면 저의 약한면이 보이게 되어 그 사람이 저에게 실망할까봐 말 못하고 상대방에게 듣기 거북한 이야기를 하는게 아닐까 걱정이 되어 말고 못하고, 계속 쌓여만 가는 감정과 상처들을 도대체 어디에 버려야 할까요?"
@jhk218,"18년 인생, 나는 무엇을 위해 살았을까??? 나 하나쯤은 없어도 어차피 세상은 아무일 없듯이 돌아갈텐데…. 너무 힘들다. 지금 순간 순간들이"
@user-pk1rw7sk4s,"가난을 모르고 살았는데 깨달았다 내가 가난하다는것을 우리가족이 가난하다는것을 그래서인지 부모님이 행동하던 모든 행동이 이해가 가기 시작한다 물건이 점점 사라진것,엄마가 맨날 힘들어하며 우는것, 아빠가 매일 새벽에 들어오는것, 언니가 갑작이 알바를 하고 부모님 눈치를 보는것 난 지금알았다 아니 지금껏 모른척 해왔다 내가 너무 이기적이라서 내가 힘들기 싫어서 남들 다 갖는 휴대폰하나 가지고 싶어서 모른척했다 그래 난 알고있었다 아빠가 힘들어도 일을 나갈때는 눈을 꼭감고 게임을 하고, 언니가 일을 하러 갈때도 인사한마디 안해줬다 진짜 내 가족이 더 힘들텐데 난 나만 힘들다고 날 속이고 죄책감을 피하며 살아왔다.근데 더 이상 그럴수가 없다 주변에서 자꾸 가난을 알려주기 때문에 속이기는 이제 정말 못한다 집주인 아줌마가 돈 때문에 초인종을 누른걸 안 순간 눈물이 자꾸 흐른다 언니 미안해 아빠 미안해 엄마 미안해 내가 미안해 지금껏 모른척 해서 내가 너무 이기적이라서 미안해"
@cosmetic686,"혼자살면 편하지~ 하는거 순간이야진짜 인간은 사회적동물인게 외로움,공허함은 반드시 찾아오더라고... 너무너무너무 외롭다ㅠ"
@brownriceh-hn,우리는 이 순간이 어떻게든 지나간다는 것을 알고있어요
@eggflower90,인생은 괴롭다는걸 인정하면서 부터 자유로워진다…
@user-bq6lz6dm9p,안힘든사람 어딧냐 다 힘들다..힘냅시다.
@KE-uo2ic,최대한 잊으려고 바쁘게 살고 있었는데 잠깐 멈추니까 왜 이렇게 힘든지.. 그냥 모든게 속상하고 그만두고 싶어요 내일은 또 우울한 지금을 잊기 위해 바쁜척 또 일상에 자신을 가두겠죠 결국 남는건 없지만 바쁜 일상이라도 없으면 의미를 모르겠으니까요.
@user-qb2uq7hw3r,"진짜 행복한줄 알았는데, 괜찮게 잘 살고있는줄 알았는데 문득 너무 힘들고 우울하고 지치네 평생 스트레스 받으면서 힘들어하는건 어쩔 수 없는거겠죠아무리 행복한 삶이여도 난 다신 안태어날래"
@user-ny6fv9ho4j,"며칠 전에 남친이랑 헤어지고 공부에 집중도 안되고 뭘 해서 돈을 벌어야할지 모르겠고 불투명한 미래에 항상 걱정하며 매일 똑같은 하루, 우울하고 힘들고 아파도 아무도 걱정 해주지 않는 날들 때문에 죽고 싶다는 생각도 많이 하고 여러가지 노래 듣고 잠도 많이 자보고 어떻게든 스트레스 풀려고 노력하는데 그러면 그럴 수록 지금 이러고 있는 내가 너무 한심해 보여서.대체 뭐 때문에 내가 지금 이렇게 악착같이 살아가는지 이유를 찾지 못해서사람은 왜 이 세상에 있어서 힘들고 어려운 일들을 다 해야하는지 이해가 안가서살아야 할 이유도 없고 의욕도 없는데, 지금 죽어도 여한이 없는데 차라리 자고 있을 때 누가 날 죽여주거나 심장마비로 죽었으면 좋겠다는 생각을 매일 하는데 왜 나는 아직도 살아있는지 모르겠어서."
@vincentnjh,모든것은 잘 될겁니다!!
@user-tr8kj4hj3p,살면서 쉬운게 왜 하나도 없을까요
@nctzen219,요즘 너무 힘들어요. 그냥 사는게 지쳤어요 하루가 너무 허무하달까 잘려고 누우면 벌써 하루는 끝나있고 그렇게 이번년도도 끝나가고 있고 친구관계는 왜 또 이러는지요즘 남사친이랑 너무 의지하는 사이가 됐어요 남사친의 친구 또 다른 남사친 때문에 너무 힘들어요 친구가 장난인지 누군가의 품에 안겨서 소리내고 울고싶어요 제발 이제 다 끝내고 싶어요 좀 있으면 졸업이니깐 버티자라는 말을 한 남사친이랑 계속 서로 해주고 있어요 3주만 버티자 졸업까지 얼마 안 남았다 이말에만 얼마나 힘을 얻는지 참 울면 약한건데 그죠 울면 지는건데 지기 싫은데 왜 그럴까요 ㅎㅎ이렇게 힘들때 저에겐 춤이라는 멋진 취미가 있어요 아무리 힘들어요 춤추면 생각이 안 나요 그냥 너무 춤 출때 만큼은 행복해요 그런 행복 느낄수 있는거 자체라 저는 정말 다행이라고 생각해요 저보다 힘든 사람은 더 많은데 그 사람들은 저보다 더 많이 일들을 해결 했잖아요 멋지다고 생각해요 3주만 버티자 잘 할수 있잖아 잘 해왔고 화이팅하자
@LoveEunoia,왜 내 뜻대로 되는 일이 하나도 없을까 너무 속상하고 슬프고 내가 왜 살고 있는지 무엇 때문에 살고 있는지도 모르겠다 친구도 가족도 내 속 마음 하나 털어 놓을 사람이 없다 옛날의 힘든 기억이 자꾸 문득 떠오를 때마다 괴롭고 힘들고 또 불안하다 잠에 들면 맨날 악몽으로 내가 싫어하고 날 힘들게 했던 사람들이 나와서 또 괴롭힌다 이제 좀 극복하고 괜찮아진 줄 알았는데 그게 아닌가봐 행복 하지도 않고 걱정도 많고 강박증도 심해지고 내가 왜 이렇게 살아가야하나 모르겠다 하고싶은거 다 하면서 살아가고 싶어도 옛날의 기억들 때문에 엄두도 못 내겠어 나를 싫어 하는 사람들이 너무 많아 나를 좋아해주는 사람은 얼마나 있을까 힘든일이 지나가면 또 다른 힘든일이 찾아오고 나 혼자 버텨내기 너무 힘들어 곧 다가올 미래가 너무 두렵고 겪지도 않았는데 벌써부터 다 포기하고 싶고 못하겠어 못 버티겠어 정말
@youngss3110,견디면 괜찮다고 그런 잔인한 말이 어딨을까요.생일날마저 감정노동을 해야해서 심신이 지쳐버리는데..그누구에게도 속시원히 말못하고 인내하고 삶의 의미를 찾으려고 하는데 안되는날인 오늘 정말 소리없이 눈물만 흘리네요.하늘에 계신 부모님이 너무도 그립고 아프고 저미는..볼수도..대화할수도..만질수도 없는 존재인데 그래서 더 보고싶고..곁에 계시다면 푹안겨 괜찮다 수고했다 한마디가 너무도 듣고 싶네요..그러나 불가능하고 일어나지 않을 일이란걸 알기에..이렇게 적어내려봅니다.소중한 음악 감사합니다.
@user-mv7et9xm1m,삶이 지옥같은건이렇게 슬프고 힘들고 외로움에도딱히 죽어야 할 그럴싸한 구실을 찾지 못하기 때문은 아닐까
@user-if7er3br9n,왜 내 마음을 몰라주는걸까 왜 나한테 그렇게 꾸짖은걸까 왜 나를 못믿는걸까그냥누가 날좀 도와주면 안돼는걸까그냥 한번이라도 안아주고 믿어주고 이해해주고 잘해주면 안돼는걸까나한테만 그러는걸까죽고싶다는 생각이 드는걸까 안아줘 달래줘 이해해줘 제발.
@_dodkleo.,그나마 주변사람 때문에 극단적 선택을 미루게 되는게 다행인걸까 ..나의 선택을 고민하게 해주는 사람들 너무 고맙고 미안하다고 말하고싶어
@user-om8nz1rh4h,우울해서들어왔는데  왈칵 눈물나는 노래네요~~
@user-hv5qk8wh7v,"고생 많았어, 많이 힘들지, 괜찮아, 수고했어, 넌 정말 대단해, 화이팅, 화이팅.. 화이팅..!"
@user-ns4vy8om1h,이번에 마지막 기말고사를 준비하게된 중3입니다. 제가 중학생활을 하며 좋은 성적을 받지못했습니다 제가 항상 친구들에게 니가 이걸 한다고? 또 찍었겠지 찍는 방법 좀 알려줘 같은 이야기를 많이 들었습니다 그것도 제일 가까운 친구들에게요 저는 그런 친구들에게 저의 능력을 보여주고싶습니다 물론 제가 그전에 공부 생각을 안한것은 아닙니다 제가 공부를 좀 늦게해 기본이 좀 부실한 것도있고 그래서 너무 공부가 힘들고 노력을 안하는 제 자신이 너무 힘들어요 하지만 무조껀 잘볼껍니다 그친구들에게 보여주는것 뿐만 아니라 고1을 준비하는 날위서라도 노력할껍니다 근데 너무 지치네요.. 이번 노래모음으로 조금 나마 힘이되었습니다
@9seebird,나 자신을 사랑하라는 말을 제일 많이 들어요 나한테는 만족하지 못하고 나는 다 못하는 거 같고 한심해요 그래서 누군가 위로해주고 잘한다라고 말해주면 눈물이 나려고 하더라구요 언제쯤 나 자신을 사랑할 수 있을까요 여기 노래 들으러 오신 분들 중에 비슷한 분들도 계실 것 같은데 당신은 정말 소중한 사람이라고 말해주고 싶어요 나 자신은 위로하지 못해도 남은 위로 할 수 있거든요 다들 힘내세요
@Kimtaewoo_,"고등학교 1학년이 지나고 벌써 고등학교 2학년 이라는 문 앞에 서 있게 되었습니다. 개학하기 전부터 코로나로 친구들과 가까이 지내지 못해 지금까지 중학교 3학년에서 다짐해왔던 친한 친구들 사귀기를 그대로 실패하면서 혼자가 되고 그 이후로 항상 외로움에 빠져있던 거 같아요.  곧 있으면 종업식인데 이대로 가기 정말 싫지만, 나름대로 방법은 또 있겠죠? 내가 원하는 모습 반이라도 이룰 수 있도록 노력해보고 싶네요. 내년엔 다들 좋은 하루만 가득하셨으면 좋겠습니다 :)"
@user-sk7dq9ts3h,제발 아무나 나를 안아줬으면 좋겠다 아무 위로 없이 안아주는 거만으로 큰 힘이 될 거 같아
@user-gu3ro8dk4b,숨 쉬기 힘들 정도로 힘든데 ..주위엔 아무도 없네.. 너무 많이 울어도 계속 눈물만 나오고 누가 좀 안아줬으면 좋겠다…사랑받고 싶은데 날 조금이라도 이해 해주는 사람 없을까….
@user-qh9yh1mj7u,국시 준비 하고 있는데 국시 준비 하는게 제 마음과 같지 않네요 침대에 누워서 듣고 있는데 듣자마자 눈물이 나네요.. 가끔 이 선택을 한게 후회되고 그러네여.. 노래를 들으니 좀 위로가 되네요 노래 들으면서 위로 받는다는게 제 자신으로 창피하네여ㅠㅠ
@user-jr6kh3kc2r,올해 진짜 안풀렸다 할머니 돌아가시고 해군부사관 떨어지고 자살시도 실패 친구와 손절 코로나 걸리고 여자한테 까이고 하.. 힘들었다 내년에는 제발 잘풀리길 기원한다
@user-qc3iv9wt6d,나 잘하고 있어 내가 최고야 난 나를 사랑해 실수 해도 괜찮아 뭐 어때 넌 너야 누군가의 삶을 길을 따라 가지마 라고 내 자신에게 말할 수 있는 날이 오기를 나조차도 나를 사랑하지 않는 날들이 더 이상 많아지지 않기를
@mobi-mw4em,하.. 정말 힘들어요 밤마다 내일이 다가오는게 두렵고 싫어요.. 그냥 지금 이대로 시간이 멈춰버렸으면 좋겠다
@jyk.5234,앗 듣자마다 눈물 왈칵… 위로택배 감사하여용
@user-nw4ih4zv7z,죽음을 결심할 정도까지 힘들었는데 왜 아직도 나아지는게 없을까요 다들 힘든거 있으면 꼭 푸세요 저처럼 한번에 터지지말고 다들 행복하세요 전 이제 그만 살랍니다
@user-qp4li5ok8t,세상이 너무 별로다…이런 세상을 바꿀 순 없는걸까 다시 처음..원점으로 돌아가서 모든 것들을 다 바꾸고싶다 나 요즘 너무 힘들어 모르는 사람도 괜찮으니까 누군가한테 안겨서 펑펑 울고 싶다
@2002ksg,요기 들어 오신분...모든 분들 힘내시고 행운이 있길!!  화이팅! 내 자신도 화이링!!!
@manta_0207,저는 올해 12살입니다. 12살이 된 뒤 부터는 스트레스와 우울감으로 모든게 제 탓인 것 같아 저 자신을 혐오하여 자해를 했고 힘든 것을 알아줬으면 했지만 제 마음을 몰라 주더라고요.....지금은 자해를 끊으려 노력 하고 있습니다. 모두 행복한 하루 되세요
@_hijinyi8473,"진짜 요즘 쓰래기 전남친이랑 몇몇애들때문에진심 죽고싶을정도로 힘들고 고민하고 생각하고 혼잣말하고 공허하고 펑펑울고 그랬는데 여기서 계속 미안하다 죄송하다며 비는건 나고 나도 내가 잘못한거 없는거 아는데 그래도 내가 내 자신에게 자존심이 없고 자존감도 더 낮아지고 그렇게 사과할때마다, 그래서 나도 그냥 내 주변 사람들한테 괜찮다 넌 잘했다 잘못없다이런말 듣고싶어 근데 나는 내가 한 행동들이옯았는지 장담할수없어서 이런말 듣고싶다는 말 쓰는것도 쫌 그런데.. 그래도 그동안 너무 참았고 힘들었어.. 나 아직 14살인데.."
@user-lz3nx1zw7u,내가 손목을 스무줄 이상 그어도 모르던 가족들 내 밝은 척을 몰랐으면서 원래 밝은 아이였지 않냐는 바보같은 말들한번이라도 날 이해해보려는 노력은 결코 하지 않는 사람들날 있는 그대로는 사랑해줄 수가 없는가보다
@user-zp2jo2on1l,저는 남자친구하고 다투고 헤어지자고 해서 울었는데 이거듣고 홀가분해졌어요
@user-xu9cx6se4p,요즘사는게힘들어서 찾아듣게되요 슬럼프비슷한게오는거같아요ㅠㅠ 말로설명이안대요 힘든게 사는게빠듯하고 칼같아서더힘드네요ㅠㅠ 마음적으로 왔다갔다..합니다
@user-rl5yv9tu1s,"살빼라는 편견 땜에 죽을꺼 같네요.. 항상 학교에선 날씬한 애들이랑 어울리는 애들만 있어서 혼자 찌질하개 앉아서 그림망 그리는데.. 밖에선 아는 척 안해주고.. 째려보고.. 거의 혼자 쭈그려 앉아서 울고 죽고 싶다는 생각 까지 했는데.. 내가 뭘 잘못했는지도 모르고 그냥.. 내가 싫어하는데 티 안내서 내가 잘 받아내는 줄 알고 맨날 나 꼬집어 보고 나보고 대놓고 ""나보단 더 뚱뚱 하네""이러는 친구들 때문에 집에서도 윗몸 일으키기 50개 상체올리기 50개 하늘 자전거 50개 복부운동 허벅지 운동 뱃살 운동 다하는데. 식단도 조절하는데.. 나는 애들이랑 별로 어울리질 못해.. 애들은 나 착하다고 허지만 속으론 다 참고있다고.. 노래를 듣다보니 운동 하다가 시간이 다 지나갔네요..ㅎ 누가.. 충분히 노력했다고.. 말해주면.. 좋겠는데.. 난 열심히 하는데.."
@user-vu3mk3hd4f,그냥-행복할꺼야  이노래도 위로가 많이 됩니다!
@user-rh6gg1cd7v,안녕하세요노래 잘 듣고 갑니다 ㅠ그리고 저 사진 감성이 너무 좋아서 그런데 사진은 혹시 어디서 받으시나요?
@consuni111,"살아가다 보면, 도망칠수도없는 고통과 마주해야할 때가 올꺼야그러면 두 눈 꼭감고 마음속으로딱 셋까지만 세다시 눈뜨면 조금 더 강한 사람이 되어있을꺼야.- 드라마 <안녕? 나야!> 中"
@skykim17,너무나 친했던 친구와 싸워버렸네요..너무 힘드네요..제가 의지했던 친구는 그아이뿐이였는데..너무 착했던 그 친구가 너무 딱딱하게 내게 답하는게 마음에 꽂히네요..너무편했던 친구에게 이젠 문자를 보내려면 큰 용기를 가져야 한단게..참..이상하고..슬퍼지네요..그친구는..제가 힘들땐 힘든거 다 받아주고 제 화도 받아준 친구인데 참 미안하고 고맙네요..그냥 너무 슬퍼서 여기에 끄적여봅니다..
@user-zb6in3rl9w,어렸을때 어른이 되면 할 수 있는게 많고 설레고 빨리 어른이 되었으면 좋겠다 했는데 32살 애기 엄마가 되고 나서 책임져야 할일들이 많고 마음이 무겁네요…남편의 잦은 거짓말과 여러가지 이유들로 이혼을 준비 중인데 너무나도 힘이드네요 저 다시 일어나서 다시 행복하게 잘 살 수 있겠죠…? 좋은 일이 일어날꺼라고 믿고 싶어요
@shine0105,공부가 너무 잘하고 싶은데 새벽만 되면 다이어리를 붙잡고 계획 세우고 내가 혼자 공부해보려 발악을 하는데 내가 자고 일어나서 막상 하는건 아무것도 없고 휴대폰만 만지고 있는 내 자신이 너무 한심해서 그런 나를 볼 때마다 자책감만 쌓여가고 자존감이 내려가고 더 나은 나를 상상하며 했던 나를 발전 시키려고 했던 건데 막상 오히려 날 더 힘들게하네요진짜 소중한 친구 3명이 있는데 제가 속 얘기를 하지도 않고 다른 사람들은 저를 다 잘하는 애로 생각하는데 마음은 계속 무너지고만 있어요 방학이라 사람을 안 만나서 그런지 갈수록 사람을 만나고 싶지가 않고 갈수록 찌는 살에 자존감이 높았던 저인데 계속 슬퍼지기만 하고 있네요 이렇게 사는게 무슨 의미가 있을까 싶기도 한 요즘 제 삶의 뱡향성이 뭘까 참 고민되네요 내 의지대로 다 되면 얼마나 좋을까 하고
@user-zr5sy7zo4x,"전 교장 손녀라고 중학교 들어올때부터 선도부장 꿈에 그리고 있었는데 선생님의 혜택때문에 걔가 선도부장이 된 것을 보고 절망했다.’내가 쟤보다 못한게 없는데,남들도 선도부에서 일 제일 잘하는게 나라는데 이건 너무 불공평 하지않나?’라는 생각만 돌아 미치겠는데 너는 나에게 반갑게 인사하는거보고 너가 미워졌어. 그래서 너보다 훨씬 도 잘나려고. 누가봐도 쟤는 대단하다라는 말이 나오도록"
@user-xv2we4xl1z,아무한테도 말도 못하겠고 빚 갚는게 너무 힘들다 내가 써봤으면 억울하지나 않을 돈들.. 갚아도 갚아도 밑 빠진 독에 물 붓기 처럼 끝이 보이질 않는다 나도 연애도 하고 싶고 옷도 사입고 싶은데 나에겐 다 사치다 이번 월급은 1년동안 안 쓴 연차수당으로 인해 평소 2.5배의 수입이 생겼지만 수습 할 상황이 또 생겨 내가 메꿔주고 정작 나에게 남은돈 주유비 빼고 한달 생활비 15만원이 남았다.. 친구 만나는것도 날 위해 쓰는 것도 자체가 사치인 삶 언제 끝나게 될 지 앞이 깜깜하다
@da._hyx,사실 행복한게 아니라 힘든거 참고 있는건데
@user-wn9cd8zp7o,요즘 되는 일이 없어서 다 포기하고 싶어요.. 겨우 버틴 오늘이 도돌이표처럼 다시 돌아오는게 너무 힘들어요  어떻게든 버티려고 헌신하는데..이렇게 지내는게 맞는지 모르겠어요 그냥 제 인생이 징크스인듯
@user-pd3gc5vq4e,이 영상 노래를 들으니까 어머니가 보고싶네요. 매일 듣고 싶어지네요.오늘도 저에 기분을 보다듬어 주네요.ㅎㅎ..오늘도 비난 받았어요. 사람들에게 말하여저를 위로해주면 좋겠지만 말을 못해서여기서는 저에 마음을 털어 놓을수 있을 것 같아요. 당신에 영상은 저에 친구가 되어주었네요. 혹시 가능하다면 제 글에댓글을 달아주어서 응원에 메시지를 보내주실수 있나요?....
@user-bj1bo4rg1u,가끔은 있잖아 내가 세상에 태어나지 않았다면 이고통들이 없었을것같아 그냥 흔적조차 다른사람들의 기억에조차 없는아이로 사라졌으면좋겠다는 생각이가끔들어 근데 그게무서워서..그냥 누군가의 품에서 나 너무힘들다고 울고싶다 날 이해해주는사람이 한명이라도있었으면 나도 날 이해해주고싶은데 그게 힘들어 그냥 내자신한테 엄격해져 근데 그럴수록 엇나가 난 그냥 안아줘 괜찮다고응원한다 해줘 그냥 날 안아줘
@user-oy3fi2tk3g,사랑조차 제대로 이루어지지 않고 사는 이나라에 우리는 무슨 정으로 살아가야하나 노래 듣다보니 이런생각이..
@cocomom.s2,아홉수에 묵삼재.. 일이 하나도 풀리지 않고.. 더 더 아프고 힘든일들의 연속이다 너무 너무 지친다 이렇게 살고 싶지 않은데... 나 잘 살수 있겠지 잘 하고 싶다 다 잘 하고 싶다 지난날들을 반성한다고 반성하는데 여전히도 제자리걸음인거같다  다 이렇게 살아가는걸까 아님 진짜 내 문제가 큰 걸까 어디서 부터 어떻게 풀어 나가야할까 많은걸 겪었음에도.. 그 모든것들이 버겁고 어렵다 무섭고 두렵다 외롭다
@notsleeping2259,내가 힘든걸 가족이 알면 더 힘들꺼야
@user-cc7dz9rv7b,"처음 한계에 부딪혔을 때는 생각보다 더 아팠고, 다시 일어날 때는 용기보다는 겁이란 것이 더 무거웠다. 그렇게 상처가 아물기도 전에 그 과정을 반복해야만 했고, 나중에는 무뎌져서 아무렇지 않은 내가 무서웠다. 주변에서도 처음에는 ""괜찮아?""라는 걱정 섞인 말을 하였지만, 나중에는 ""괜찮아"" 라고 나를 납득시키려 했다.그래서일까? 나는 괜찮다고 남의 아픔을 마치 이미 경험한 듯, 그래서 당연하다는 듯 말하는 어른보다는 괜찮냐고 걱정하며 안아주고 온기를 나눠 주는 어른이 되고 싶다.당신의 하루는 괜찮은가요? 괴롭지는 않나요? 만약 지칠대로 지쳐서, 눈에 자국만 선명한 요즘이라도. 본인 스스로 만큼은 내려놓지 말아줘요. 부탁이니까."
@brand_1R,"보고싶은 이 밤은 왜 끝 없이 이어지는가내 아쉬운 마음은 왜 끝 없이 너에게 닿지 않는가 ,, 이젠 놔 주어야 하는데 쉽지 않은가"
@yeah-ww9bp,진짜 힘든데 관둘 수 있는 용기도 없고 후회할 것 같다는 막연함과 이 길이 아니면 진짜 아무것도 아닌 내가 너무 싫어서 시험기간만 되면 너무 힘들다. 맨날 울고 불안해하고 자기비하하고 나중을 보면 아무것도 아닐 이 시간을 어떻게든 피하고 싶어서 애쓰는 모양새가 너무 볼품없다. 누군가한테 계속 기대고 싶은데 다른 사람한테는 멀쩡한 척하면서 부모님만 상처주고 어쩌다 한 번 다른 사람들에게 내 진짜 마음을 보여주면 다시는 내 마음을 열지 않는다. 내 자신이 너무 창피하고 나로 인해 누군가가 곤란해하는 모습을 상상하면 더 괴로워서. 이제는 다 그만하고 싶어. 그만 힘들고 싶어. 그만 불안하고 싶어. 그만 초조하고 싶어. 그냥 다 그만하고 싶어. 애초에 시작하지 않았으면 좋았을텐데.
@sja1515,고등학교 진학 후 입시 문제와 친구 문제로 너무마음이 많이 상처 입은것 같아 너무 우울하고 너무 힘든데 조금은 위로가 되네요…
